Vad heter Norges huvudstad?;Oslo;Bergen;KöpenhamnVad står ABBA för?;Agneta Björn Benny Annefrid;Kalle och Lisa;Smarrig SillNär dog Karl XII?;1718;1717;1818Om du ber Google Maps berätta distans(bilväg) mellan Stockholm och Göteborg. Vilket avstånd i km får du då som svar?;469;502;550Om du befinner dig på stranden South Beach, vilken stad är du då i? ;Miami;Sydney;San DiegoForne storspelaren Henrik Larsson som är tränare i Helsingborg IF har i sitt lag(2016) även sin son. Vad heter sonen i förnamn?;Jordan;Brooklyn;VictorOzzie Osburne var förgrundsfigur i ett klassiskt hårdrocksband, vilket?;Black Sabbath;Scorpions;AC/DCVilken religion är den största med ca 2,4 miljarder anhängare (enl Wikpedia, 2016)? ;Kristendom;Islam;HinduismArgentina chockade Storbritannien en morgon när dom vaknade upp till nyheten att Argentina hade invaderat de brittiska Falklandsöarna. Vilket är året? ;1982;1972;1962